{
  "schemaVersion": 1,
  "contract": "kfd.self-conformance-historical-replay/v1",
  "profile": "kfd-self-conformance@1.0.0-alpha.1",
  "reportId": "kfd-history-alpha28-to-live-alpha55",
  "retrospective": true,
  "profileAvailableAtEvent": false,
  "generatedFromImmutableSources": true,
  "sources": [
    {
      "id": "alpha28-package",
      "kind": "npm-package",
      "repository": "https://registry.npmjs.org/@kungfu-tech/kfd/1.0.0-alpha.28",
      "commit": null,
      "path": "npm:@kungfu-tech/kfd@1.0.0-alpha.28",
      "contentRoot": "sha256:3d1adb0af8cb5238c0eea27fe7ad7b900fbf54b3733839582da76c8a3c9e64c0",
      "payload": {
        "name": "@kungfu-tech/kfd",
        "version": "1.0.0-alpha.28",
        "tarballSha256": "sha256:279cf2adcfe0c5cd9d31ecf0e6317d5a5f2ff854c49c39f7e135ad4e2cc43ce1",
        "shasum": "c783cffa29b361f2a6675ceef9d34f2763b7da7e",
        "integrity": "sha512-pTNOaJOgsfMehptEFcqhICzuO/c0ZJwrYlZcgLgIbOu2V2c/MDCKOuPXmD/RH1dpIjQ+SfZROuQqsPH5ERlQ/w=="
      }
    },
    {
      "id": "alpha28-registry",
      "kind": "git-registry",
      "repository": "https://github.com/kungfu-systems/kfd",
      "commit": "04f839e8e7834c9eda3d46424de2f59f53623e8f",
      "path": "registry.json",
      "contentRoot": "sha256:5daccf563706ed87b521298b92c50e07505881dae28297dd86f4e0630dc4de8b",
      "payload": {
        "schemaVersion": 1,
        "contract": "kfd-registry",
        "entries": [
          {
            "number": 1,
            "id": "KFD-1",
            "slug": "kfd-1",
            "title": "Facts must not drift: contract worlds need one fact source",
            "kind": "procedure",
            "status": "active",
            "path": "decisions/KFD-1.md",
            "url": "https://kfd.libkungfu.dev/1"
          },
          {
            "number": 2,
            "id": "KFD-2",
            "slug": "kfd-2",
            "title": "Trust must start from facts: responsibility must be inspectable",
            "kind": "principle",
            "status": "active",
            "path": "decisions/KFD-2.md",
            "url": "https://kfd.libkungfu.dev/2"
          },
          {
            "number": 3,
            "id": "KFD-3",
            "slug": "kfd-3",
            "title": "Cooperation must start from trusted value: compliance must not be coerced",
            "kind": "principle",
            "status": "active",
            "path": "decisions/KFD-3.md",
            "url": "https://kfd.libkungfu.dev/3"
          },
          {
            "number": 4,
            "id": "KFD-4",
            "slug": "kfd-4",
            "title": "Views must remain bound to declared perspectives: timelines make perspective durable and replay makes it transferable",
            "kind": "principle",
            "status": "active",
            "path": "decisions/KFD-4.md",
            "url": "https://kfd.libkungfu.dev/4"
          },
          {
            "number": 5,
            "id": "KFD-5",
            "slug": "kfd-5",
            "title": "Primitive discovery must join perspective-grounded judgment with scalable reasoning: discovery and qualification are different acts",
            "kind": "procedure",
            "status": "active",
            "path": "decisions/KFD-5.md",
            "url": "https://kfd.libkungfu.dev/5"
          },
          {
            "number": 6,
            "id": "KFD-6",
            "slug": "kfd-6",
            "title": "Autonomous discovery must remain grounded in causal experience: the loop must transform perspectives, not only mine patterns",
            "kind": "procedure",
            "status": "draft",
            "path": "decisions/KFD-6.md",
            "url": "https://kfd.libkungfu.dev/6"
          }
        ]
      }
    },
    {
      "id": "alpha36-package",
      "kind": "npm-package",
      "repository": "https://registry.npmjs.org/@kungfu-tech/kfd/1.0.0-alpha.36",
      "commit": null,
      "path": "npm:@kungfu-tech/kfd@1.0.0-alpha.36",
      "contentRoot": "sha256:ba4561977b529af084a9a9f87741e7461ce0e8931aa4cf887b7ab46cfb97a557",
      "payload": {
        "name": "@kungfu-tech/kfd",
        "version": "1.0.0-alpha.36",
        "sourceTag": "v1.0.0-alpha.36",
        "sourceCommit": "c80a6b19d93d733e872bae6d53d1555aeed0b162",
        "tarballSha256": "sha256:ef8a14fb2f7bbb36c09c434589f6a9eae30d47e8ca928774a04072282c44ee32",
        "shasum": "6f7d1148484f69b24492e93a1390fd0788834b86",
        "integrity": "sha512-SmIE0qf7kHf2g8lIRhigfqoYsO5eHDvJLE3nogXnjAVEFe/uw0jjsDTOx2nPwaq2yC04tHmNtynHj/UcIEb4SA=="
      }
    },
    {
      "id": "foundation-revision-admission",
      "kind": "git-document",
      "repository": "https://github.com/kungfu-systems/kfd",
      "commit": "8d9d6338afd62e01aac4c776313ba40e44f7700a",
      "path": "docs/foundation-revision-2026-07-21-decision-admission.json",
      "contentRoot": "sha256:2b1818caa9d418d84e707a52968eaf3f4d35ac33ded780b3204ad180f1a370f7",
      "payload": {
        "schema": "kfd.foundation-revision/v1",
        "id": "decision-admission-layer-2026-07-21",
        "status": "review-coordinate-declared",
        "preStable": true,
        "impact": {
          "level": "major",
          "class": "breaking"
        },
        "authorization": {
          "status": "authorized",
          "authority": "kfd-maintainer",
          "record": "docs/foundation-revision-2026-07-21-decision-admission.md"
        },
        "independentReview": {
          "status": "review-coordinate-declared",
          "coordinate": "https://github.com/kungfu-systems/kfd/pull/230"
        },
        "mappings": [
          {
            "from": null,
            "to": "KFD-11",
            "relation": "allocated-by-foundation-revision",
            "meaning": "Consequential settlement must separate claim, assessment, decision, and admission"
          },
          {
            "from": "KFD-11@pre-2026-07-21",
            "to": "KFD-12",
            "relation": "renumbered",
            "meaning": "Software work must keep Initiative and Assignment distinct"
          },
          {
            "from": "KFD-12@pre-2026-07-21",
            "to": "KFD-13",
            "relation": "renumbered",
            "meaning": "Project settlement must bind authorities without absorbing them"
          }
        ],
        "preservedCoordinates": {
          "commits": true,
          "tags": true,
          "packages": true,
          "digests": true,
          "immutableRenderedArtifacts": true
        },
        "nonClaims": [
          "The revision does not activate KFD-11, KFD-12, or KFD-13.",
          "The revision does not reinterpret immutable prerelease coordinates.",
          "The revision does not establish universal cross-domain qualification."
        ]
      }
    },
    {
      "id": "foundation-revision-registry",
      "kind": "git-registry",
      "repository": "https://github.com/kungfu-systems/kfd",
      "commit": "8d9d6338afd62e01aac4c776313ba40e44f7700a",
      "path": "registry.json",
      "contentRoot": "sha256:204014d1169071ef6ecc72989ae2dc63c1545df230e23b7f784a5f6ecad27898",
      "payload": {
        "schemaVersion": 1,
        "contract": "kfd-registry",
        "entries": [
          {
            "number": 1,
            "id": "KFD-1",
            "slug": "kfd-1",
            "title": "Facts must not drift",
            "kind": "procedure",
            "status": "active",
            "path": "decisions/KFD-1.md",
            "url": "https://kfd.libkungfu.dev/1"
          },
          {
            "number": 2,
            "id": "KFD-2",
            "slug": "kfd-2",
            "title": "Trust must start from facts",
            "kind": "principle",
            "status": "active",
            "path": "decisions/KFD-2.md",
            "url": "https://kfd.libkungfu.dev/2"
          },
          {
            "number": 3,
            "id": "KFD-3",
            "slug": "kfd-3",
            "title": "Cooperation must start from trusted value",
            "kind": "principle",
            "status": "active",
            "path": "decisions/KFD-3.md",
            "url": "https://kfd.libkungfu.dev/3"
          },
          {
            "number": 4,
            "id": "KFD-4",
            "slug": "kfd-4",
            "title": "Views must remain bound to declared perspectives",
            "kind": "principle",
            "status": "active",
            "path": "decisions/KFD-4.md",
            "url": "https://kfd.libkungfu.dev/4"
          },
          {
            "number": 5,
            "id": "KFD-5",
            "slug": "kfd-5",
            "title": "Primitive discovery must separate genesis from qualification",
            "kind": "procedure",
            "status": "active",
            "path": "decisions/KFD-5.md",
            "url": "https://kfd.libkungfu.dev/5"
          },
          {
            "number": 6,
            "id": "KFD-6",
            "slug": "kfd-6",
            "title": "Autonomous discovery must remain grounded in causal experience",
            "kind": "procedure",
            "status": "draft",
            "path": "decisions/KFD-6.md",
            "url": "https://kfd.libkungfu.dev/6"
          },
          {
            "number": 7,
            "id": "KFD-7",
            "slug": "kfd-7",
            "title": "Real-world action must keep state, occurrence, and action coordinates distinct",
            "kind": "principle",
            "status": "active",
            "path": "decisions/KFD-7.md",
            "url": "https://kfd.libkungfu.dev/7"
          },
          {
            "number": 8,
            "id": "KFD-8",
            "slug": "kfd-8",
            "title": "Perspective must remain bound to admitted facts and declared loss",
            "kind": "principle",
            "status": "draft",
            "path": "decisions/KFD-8.md",
            "url": "https://kfd.libkungfu.dev/8"
          },
          {
            "number": 9,
            "id": "KFD-9",
            "slug": "kfd-9",